{
  "job_id": "Q4-007",
  "batch": 2,
  "category": "妊娠・出産",
  "type": "seido-kaisetsu",
  "title_draft": "出産・子育て応援交付金はいくらもらえる？",
  "tool_ref": null,
  "related_tool_list_no": null,
  "persona": "ペルソナ4: 鈴木奈々（34歳・妊活→プレママ）",
  "priority": "A",
  "seido_data": [
    {
      "file": "shussan-oen-kofukin.json",
      "status": "stub"
    }
  ],
  "status": "queued",
  "notes": "seido_data に status=stub を含む。執筆時に factory/data/seido/ の一次データ整備を先行するか、facts[].stub_reason を明記すること。"
}
