{
  "job_id": "Q4-025",
  "batch": 1,
  "category": "家事・料理",
  "type": "tool-narisou",
  "title_draft": "調味料の大さじ・小さじ⇄グラム換算はどんな基準？",
  "tool_ref": "choumiryou-kanzan",
  "related_tool_list_no": 38,
  "persona": "ペルソナ1: 佐藤美咲（32歳・専業主婦・子ども2人）",
  "priority": "S",
  "seido_data": [
    {
      "file": "choumiryou-kanzan-kijun.json",
      "status": "ready"
    }
  ],
  "status": "gated_pass",
  "notes": "seido_data に status=stub を含む。執筆時に factory/data/seido/ の一次データ整備を先行するか、facts[].stub_reason を明記すること。"
}
