{"job_id":"Q4-073","batch":3,"category":"妊娠・出産","type":"tool-narisou","title_draft":"妊娠中・授乳中の栄養付加量早見の使い方","tool_ref":"shokuji-sesshu-kijun-ninpu","related_tool_list_no":68,"persona":"ペルソナ4: 鈴木奈々（34歳・妊活→プレママ）","priority":"C","seido_data":[{"file":"shokuji-sesshu-kijun-ninpu.json","status":"ready","path":"data/seido/shokuji-sesshu-kijun-ninpu.json"}],"status":"gated_pass","notes":"P3ツール併走型。付加量と総摂取量の違いに焦点を置き、制度記事とツールへ導線を設置。"}
