{
  "job_id": "Q4-026",
  "batch": 1,
  "category": "家事・料理",
  "type": "seido-kaisetsu",
  "title_draft": "炊飯の水加減、合数⇄グラム換算はどう決まる？",
  "tool_ref": null,
  "related_tool_list_no": 39,
  "persona": "ペルソナ1: 佐藤美咲（32歳・専業主婦・子ども2人）",
  "priority": "S",
  "seido_data": [
    {
      "file": "suihan-mizukagen-kijun.json",
      "status": "stub"
    }
  ],
  "status": "queued",
  "notes": "seido_data に status=stub を含む。執筆時に factory/data/seido/ の一次データ整備を先行するか、facts[].stub_reason を明記すること。"
}
