{
  "job_id": "Q4-066", "batch": 3, "category": "介護", "type": "tool-narisou",
  "title_draft": "介護休業給付金はいくら？ 計算ツールの結果の読み方", "tool_ref": "kaigo-kyugyou-kyufukin", "related_tool_list_no": 91,
  "persona": "ペルソナ5: 高橋京子（52歳・パート・親の介護が視野）", "priority": "C",
  "seido_data": [{ "file": "kaigo-kyugyou-kyufukin.json", "status": "ready", "path": "data/seido/kaigo-kyugyou-kyufukin.json" }],
  "status": "gated_pass", "notes": "P3ツール併走記事。制度解説記事と実在ツールへ内部リンクを設置。"
}
