{
  "job_id": "Q4-044",
  "batch": 2,
  "category": "健康・美容",
  "type": "tool-narisou",
  "title_draft": "PMS・体調予測カレンダーはどう使う？周期連動の仕組み",
  "tool_ref": "pms-taichou-yosoku",
  "related_tool_list_no": 67,
  "persona": "ペルソナ3: 山本遥（29歳・独身・総合職）",
  "priority": "A",
  "seido_data": [
    {
      "file": "pms-yosoku-shikumi.json",
      "status": "ready",
      "path": "data/tables/pms-yosoku-shikumi.json"
    }
  ],
  "status": "queued",
  "notes": "seido_data は全て status=ready（一次データ整備済み）。facts[].seido_ref は path のファイルを root 形式で参照すること（例: \"pms-yosoku-shikumi.json#data.<パス>.value\"）。"
}
