{
  "job_id": "Q4-046",
  "batch": 3,
  "category": "健康・美容",
  "type": "seido-kaisetsu",
  "title_draft": "紫外線対策・日焼け止めの使用量目安はどう決まる？",
  "tool_ref": null,
  "related_tool_list_no": 73,
  "persona": "ペルソナ3: 山本遥（29歳・独身・総合職）",
  "priority": "C",
  "seido_data": [
    {
      "file": "hiyakedome-shiyouryou-kijun.json",
      "status": "ready",
      "path": "data/tables/hiyakedome-shiyouryou-kijun.json"
    }
  ],
  "status": "queued",
  "notes": "seido_data は全て status=ready（一次データ整備済み）。facts[].seido_ref は path のファイルを root 形式で参照すること（例: \"hiyakedome-shiyouryou-kijun.json#data.<パス>.value\"）。"
}
