{
  "job_id": "Q4-057",
  "batch": 2,
  "category": "介護",
  "type": "seido-kaisetsu",
  "title_draft": "高額介護サービス費はいくらから対象になる？",
  "tool_ref": null,
  "related_tool_list_no": 93,
  "persona": "ペルソナ5: 高橋京子（52歳・パート・親の介護が視野）",
  "priority": "A",
  "seido_data": [
    {
      "file": "kougaku-kaigo-service-hi.json",
      "status": "ready",
      "path": "data/seido/kougaku-kaigo-service-hi.json"
    }
  ],
  "status": "gated_pass",
  "notes": "seido_data は全て status=ready（一次データ整備済み）。facts[].seido_ref は path のファイルを root 形式で参照すること（例: \"kougaku-kaigo-service-hi.json#data.<パス>.value\"）。"
}
