{
  "job_id": "Q4-018",
  "batch": 2,
  "category": "子育て",
  "type": "seido-kaisetsu",
  "title_draft": "高等学校等就学支援金（高校無償化）の対象と所得基準",
  "tool_ref": null,
  "related_tool_list_no": null,
  "persona": "ペルソナ1: 佐藤美咲（32歳・専業主婦・子ども2人）",
  "priority": "B",
  "seido_data": [
    {
      "file": "koukou-shugaku-shienkin.json",
      "status": "ready",
      "path": "data/seido/koukou-shugaku-shienkin.json"
    }
  ],
  "status": "queued",
  "notes": "seido_data は全て status=ready（一次データ整備済み）。facts[].seido_ref は path のファイルを root 形式で参照すること（例: \"koukou-shugaku-shienkin.json#data.<パス>.value\"）。"
}
