{
  "job_id": "Q4-008",
  "batch": 3,
  "category": "妊娠・出産",
  "type": "seido-kaisetsu",
  "title_draft": "不妊治療の保険適用範囲と自己負担はどれくらい？",
  "tool_ref": null,
  "related_tool_list_no": 8,
  "persona": "ペルソナ4: 鈴木奈々（34歳・妊活→プレママ）",
  "priority": "A",
  "seido_data": [
    {
      "file": "funin-chiryou-hoken-tekiyou.json",
      "status": "stub"
    }
  ],
  "status": "queued",
  "notes": "seido_data に status=stub を含む。執筆時に factory/data/seido/ の一次データ整備を先行するか、facts[].stub_reason を明記すること。"
}
